{"$schema":"https://json-schema.org/draft/2020-12/schema","$id":"https://atlas.internationalbrainlab.org/schema/v0.1/statistics.schema.json","title":"Descriptive statistics and histograms v0.1","type":"object","additionalProperties":false,"required":["format","population","global","regional_summary"],"properties":{"format":{"const":"ephys-atlas-statistics-v0.1"},"population":{"type":"string","minLength":1},"global":{"type":"object","additionalProperties":false,"required":["count","missing_count","min","max","mean","std","median"],"properties":{"count":{"type":"integer","minimum":0},"missing_count":{"type":"integer","minimum":0},"min":{"type":["number","null"]},"max":{"type":["number","null"]},"mean":{"type":["number","null"]},"std":{"type":["number","null"]},"median":{"type":["number","null"]},"q05":{"type":["number","null"]},"q25":{"type":["number","null"]},"q75":{"type":["number","null"]},"q95":{"type":["number","null"]}}},"regional_summary":{"type":"object","additionalProperties":false,"required":["fields","values"],"properties":{"fields":{"$ref":"common.schema.json#/$defs/summaryFields"},"values":{"$ref":"common.schema.json#/$defs/binaryArray"}}},"histogram":{"type":"object","additionalProperties":false,"required":["edges","global_counts","regional_counts","bin_rule"],"properties":{"edges":{"type":"array","minItems":2,"items":{"type":"number"}},"global_counts":{"type":"array","minItems":1,"items":{"type":"integer","minimum":0}},"regional_counts":{"$ref":"common.schema.json#/$defs/binaryArray"},"bin_rule":{"const":"left-closed-right-open-last-closed"}}}}}
