{
  "format": "ephys-atlas-statistics-v0.1",
  "global": {
    "count": 11,
    "max": 3.5,
    "mean": 1.4090909090909092,
    "median": 1.5,
    "min": -0.5,
    "missing_count": 1,
    "q05": -0.25,
    "q25": 0.5,
    "q75": 2.25,
    "q95": 3.25,
    "std": 1.2026142323020867
  },
  "histogram": {
    "bin_rule": "left-closed-right-open-last-closed",
    "edges": [
      -0.5,
      0.0,
      0.5,
      1.0,
      1.5,
      2.0,
      2.5,
      3.0,
      3.5
    ],
    "global_counts": [
      1,
      1,
      2,
      1,
      2,
      1,
      1,
      2
    ],
    "regional_counts": {
      "bytes": 128,
      "dtype": "uint32",
      "endianness": "little",
      "order": "C",
      "path": "allen.hist.u32",
      "sha256": "28a3ad061b2214499aaa189e6cf41b886b6a9cb5e3d7d055dc1e3564a068c90a",
      "shape": [
        4,
        8
      ]
    }
  },
  "population": "synthetic fixture observations assigned to Allen fixture regions",
  "regional_summary": {
    "fields": [
      "count",
      "missing_count",
      "min",
      "max",
      "mean",
      "std",
      "median",
      "q05",
      "q25",
      "q75",
      "q95"
    ],
    "values": {
      "bytes": 352,
      "dtype": "float64",
      "endianness": "little",
      "order": "C",
      "path": "allen.summary.f64",
      "sha256": "93fe024b4dbe00f772a6a967b441629ec8a4c872bdd6000bfdcbbba621efb804",
      "shape": [
        4,
        11
      ]
    }
  }
}
